{"budgets": {"allocation_refused": false, "encoded_bytes": 2400, "key_rows": {"limit": 65536, "occupied": 3, "refused": 0}, "object_rows": {"limit": 65536, "occupied": 2, "refused": 0}, "refusal_reason": "none", "unknown_rows": {"occupied": 0}}, "gaps": {"rows": [], "suppressed": 0}, "key_operations": [{"active": 0, "cancelled": 0, "category": "sign", "completed": 10, "failed": 0, "instance": "i1", "key_join_lost": 0, "metadata_at_use": "rsa_2048", "object": 11, "role": "key", "started": 10, "unit": "operations", "unknown": 0}, {"active": 0, "cancelled": 0, "category": "wrap", "completed": 1, "failed": 1, "instance": "i1", "key_join_lost": 0, "metadata_at_use": "rsa_2048", "object": 11, "role": "key", "started": 2, "unit": "operations", "unknown": 0}, {"active": 0, "cancelled": 0, "category": "verify", "completed": 10, "failed": 2, "instance": "i1", "key_join_lost": 0, "metadata_at_use": "rsa_2048", "object": 12, "role": "key", "started": 12, "unit": "operations", "unknown": 0}], "objects": [{"accessing_sessions": 1, "attribution": "valid", "attribution_reason": null, "birth": {"end_ns": 2000, "start_ns": 1000}, "creation": "generate_pair", "established": {"class": {"status": "value", "value": 3}, "ec_params": {"status": "unknown", "value": null}, "key_type": {"status": "value", "value": 0}, "modulus_bits": {"status": "value", "value": 2048}, "token": {"status": "value", "value": 0}, "value_len": {"status": "unknown", "value": null}}, "label": "rsa_2048", "lifetime": "destroyed", "lifetime_reason": null, "object": 11, "origin": "created", "queries": {"class": "established", "ec_params": "not_queried", "key_type": "established", "modulus_bits": "established", "token": "established", "value_len": "not_queried"}, "requested": {"class": {"status": "value", "value": 3}, "ec_params": {"status": "unknown", "value": null}, "key_type": {"status": "value", "value": 0}, "modulus_bits": {"status": "unknown", "value": null}, "token": {"status": "value", "value": 0}, "value_len": {"status": "unknown", "value": null}}, "session": 1, "successful_key_references": 10, "successful_references": 31}, {"accessing_sessions": 1, "attribution": "valid", "attribution_reason": null, "birth": {"end_ns": 2100, "start_ns": 1100}, "creation": "generate_pair", "established": {"class": {"status": "value", "value": 2}, "ec_params": {"status": "unknown", "value": null}, "key_type": {"status": "value", "value": 0}, "modulus_bits": {"status": "value", "value": 2048}, "token": {"status": "value", "value": 0}, "value_len": {"status": "unknown", "value": null}}, "label": "rsa_2048", "lifetime": "destroyed", "lifetime_reason": null, "object": 12, "origin": "created", "queries": {"class": "established", "ec_params": "not_queried", "key_type": "established", "modulus_bits": "established", "token": "established", "value_len": "not_queried"}, "requested": {"class": {"status": "value", "value": 2}, "ec_params": {"status": "unknown", "value": null}, "key_type": {"status": "value", "value": 0}, "modulus_bits": {"status": "value", "value": 2048}, "token": {"status": "value", "value": 0}, "value_len": {"status": "unknown", "value": null}}, "session": 1, "successful_key_references": 10, "successful_references": 22}], "reason": "none", "revision": 1, "sessions": [{"origin": "opened", "session": 1, "status": "closed"}], "status": "populated", "unknown_key_operations": [], "version": 1}
